{
  "contract_version": "engine-steps/0",
  "step": "gate",
  "run_id": "run-demo-0001",
  "data_class": "synthetic",
  "verdict": "pass",
  "gates": [
    {
      "gate": "safety",
      "status": "pass"
    },
    {
      "gate": "improvement",
      "status": "pass"
    }
  ],
  "judge_actor": "actor-judge",
  "quality_claims": "forbidden"
}
